{
    "$schema": "http://json-schema.org/draft-07/schema#",
    "$id": "https://github.com/aidevme/PPTB-Tools/tools/dataverse-early-bound-typescript-generator/src/config/dataverse-early-bound-typescript-generator-config.schema.json",
    "title": "Dataverse Early-Bound TypeScript Generator config",
    "description": "Tool settings and saved projects for the Dataverse Early-Bound TypeScript Generator. dataverse-early-bound-typescript-generator-config.json holds the defaults bundled at build time; values saved in the tool are kept in PPTB's per-tool settings in the same shape.",
    "type": "object",
    "properties": {
        "$schema": {
            "description": "Path or URL of this schema, for editor validation. Ignored by the tool.",
            "type": "string"
        },
        "general": {
            "$ref": "#/definitions/general"
        },
        "deleteOrphanedFiles": {
            "description": "Delete files in the output folders that the current selection no longer generates. When true, Generate deletes them permanently after the user confirms the list; when false, they're only reported. Shown on the Settings panel's Generate & files tab and as a switch in Preview and generate.",
            "type": "boolean",
            "default": false
        },
        "confirmBeforeGenerate": {
            "description": "Ask for confirmation before Generate writes files, naming the output folder and how many files will be created and overwritten. Overwrites can't be undone. Shown on the Settings panel's Generate & files tab.",
            "type": "boolean",
            "default": false
        },
        "skipDuplicateIdentifiers": {
            "description": "Don't write generated files that declare a name more than once (two choice labels that become the same enum member name), since TypeScript won't compile them. When false, they're written and only reported. Shown on the Settings panel's Generate & files tab.",
            "type": "boolean",
            "default": false
        },
        "renameDuplicateIdentifiers": {
            "description": "Rename later duplicate enum members (two choice labels that become the same name) to <Name>_<Value>, for example InProgress_700970000, so the generated files compile. When false, the output matches dataverse-gen and the files are reported as having duplicate identifiers. Shown on the Settings panel's Generate & files tab and as a switch in Preview and generate.",
            "type": "boolean",
            "default": false
        },
        "generateTemplates": {
            "description": "Write dataverse-gen's EJS templates to the project's templateRoot (_templates by default) on Generate, overwriting edited copies, like dataverse-gen eject. When false, Generate doesn't write them and leaves existing copies untouched. Shown on the Settings panel's Generate & files tab.",
            "type": "boolean",
            "default": true
        },
        "projectDefaults": {
            "$ref": "#/definitions/projectDefaults"
        },
        "projects": {
            "description": "Projects created with the New Project dialog.",
            "type": "array",
            "default": [],
            "items": {
                "$ref": "#/definitions/project"
            }
        }
    },
    "additionalProperties": false,
    "definitions": {
        "isoDateTime": {
            "description": "ISO 8601 timestamp in UTC, as written by Date.toISOString().",
            "type": "string",
            "format": "date-time"
        },
        "general": {
            "description": "Settings on the General tab: how the tool itself behaves. Missing or mistyped keys fall back to the defaults; numbers are rounded and clamped to their range.",
            "type": "object",
            "properties": {
                "showProjectLoadedNotification": {
                    "description": "Show the \"Project loaded\" notification after a project opens.",
                    "type": "boolean",
                    "default": true
                },
                "showPreviewReadyNotification": {
                    "description": "Show the \"Preview ready\" notification after a preview.",
                    "type": "boolean",
                    "default": true
                },
                "showGenerationCompleteNotification": {
                    "description": "Show the \"Generation complete\" notification after Generate.",
                    "type": "boolean",
                    "default": true
                },
                "recentProjectCount": {
                    "description": "Recent projects offered on the Project card. 0 hides the list.",
                    "type": "integer",
                    "minimum": 0,
                    "maximum": 10,
                    "default": 3
                },
                "selectionRowLimit": {
                    "description": "Rows shown at most in each Select table (tables, actions, functions); refine the search to see others.",
                    "type": "integer",
                    "minimum": 100,
                    "maximum": 2000,
                    "default": 500
                }
            },
            "additionalProperties": false
        },
        "projectDefaults": {
            "description": "Options a new project starts with: applied when a project folder without .dataverse-gen.json is opened. Projects that already have one keep their own values. Missing or mistyped keys fall back to dataverse-gen's defaults.",
            "type": "object",
            "properties": {
                "outputRoot": {
                    "description": "Output folder, relative to the project folder. Written to a new project's output.outputRoot. A blank value falls back to the default.",
                    "type": "string",
                    "minLength": 1,
                    "default": "./src/dataverse-gen"
                },
                "generateEntityTypes": {
                    "description": "Generate an early-bound interface per table for dataverse-ify. Written to a new project's generateEntityTypes.",
                    "type": "boolean",
                    "default": true
                },
                "generateFormContext": {
                    "description": "Generate a typed <Table>FormContext interface per table for form scripts. Written to a new project's generateFormContext.",
                    "type": "boolean",
                    "default": false
                },
                "generateIndex": {
                    "description": "Generate an index.ts that re-exports every generated file. Written to a new project's generateIndex.",
                    "type": "boolean",
                    "default": true
                }
            },
            "additionalProperties": false
        },
        "project": {
            "description": "A saved project. The tool skips entries missing id, name, location or createdOn, and fills in description, version and modifiedOn when absent.",
            "type": "object",
            "properties": {
                "id": {
                    "description": "Unique id, generated with crypto.randomUUID().",
                    "type": "string",
                    "pattern": "^[0-9a-fA-F]{8}-[0-9a-fA-F]{4}-[0-9a-fA-F]{4}-[0-9a-fA-F]{4}-[0-9a-fA-F]{12}$"
                },
                "name": {
                    "description": "Project name. Unique among saved projects, ignoring case.",
                    "type": "string",
                    "minLength": 1
                },
                "description": {
                    "description": "Optional description.",
                    "type": "string",
                    "default": ""
                },
                "location": {
                    "description": "Absolute path of the project folder, usually the one with package.json and .dataverse-gen.json.",
                    "type": "string",
                    "minLength": 1
                },
                "version": {
                    "description": "Project version. Starts at 1.0.0 and gets a patch bump when a Generate run adds files or stops producing ones the previous run did.",
                    "type": "string",
                    "pattern": "^\\d+\\.\\d+\\.\\d+$",
                    "default": "1.0.0"
                },
                "createdOn": {
                    "$ref": "#/definitions/isoDateTime",
                    "description": "When the project was created."
                },
                "modifiedOn": {
                    "$ref": "#/definitions/isoDateTime",
                    "description": "When a Generate run last added or dropped files. Defaults to createdOn."
                },
                "lastGeneratedFiles": {
                    "description": "Output files the last Generate run produced, relative to the output folder with forward slashes. Absent until the project is first generated.",
                    "type": "array",
                    "items": {
                        "type": "string",
                        "minLength": 1
                    },
                    "uniqueItems": true
                }
            },
            "required": [
                "id",
                "name",
                "location",
                "createdOn"
            ],
            "additionalProperties": false
        }
    }
}
